`id`,`url`,`name`,`description`,`domain`
5573155,https://api.github.com/repos/almp1-12/phonegap-start,phonegap-start,A starting-point for PhoneGap apps,Applied computing
5593627,https://api.github.com/repos/nicktoumpelis/HiBeacons,HiBeacons,A very nice iBeacons demo app.,Applied computing
5597614,https://api.github.com/repos/bperin/FontAwesomeAndroid,FontAwesomeAndroid,Use the font awesome icon library in android projects,Human-centered computing
5598479,https://api.github.com/repos/nghuuphuoc/bootstrapvalidator,bootstrapvalidator,A jQuery plugin to validate form fields. Use with Bootstrap 3,Software and its engineering
5600557,https://api.github.com/repos/KKBOX/CompassApp,CompassApp,Compass.app helps designers compile stylesheets easily without resorting to command line interface,Software and its engineering
5602838,https://api.github.com/repos/ben-eb/grunt-available-tasks,grunt-available-tasks,List available Grunt tasks & targets.,Software and its engineering
5604899,https://api.github.com/repos/CEWendel/SWTableViewCell,SWTableViewCell,An easy-to-use UITableViewCell subclass that implements a swippable content view which exposes utility buttons (similar to iOS 7 Mail Application),Human-centered computing
5617024,https://api.github.com/repos/soulmachine/leetcode,leetcode,LeetCodeŽ¢÷¤£•_Î151ŽÒŽ¢÷Œ¨Î¾¥«äö,Empty
5630665,https://api.github.com/repos/creolab/laravel-modules,laravel-modules,Application specific modules in Laravel 4,Software and its engineering
5636078,https://api.github.com/repos/sameersbn/docker-gitlab,docker-gitlab,Dockerized GitLab,Software and its engineering
5718353,https://api.github.com/repos/rnmp/coleure,coleure,Color management made easy (and fun.),Human-centered computing
5731028,https://api.github.com/repos/staha/demo_app,demo_app,Ruby on Rails Tutorial Demo Application,Applied computing
5741726,https://api.github.com/repos/sjwhitworth/golearn,golearn,Machine Learning for Go,Computing Technologies
5778983,https://api.github.com/repos/pimoroni/eagle,eagle,Custom Eagle parts that we've created where needed. Please feel free to use, extend, and share! (CC v3.0 Share-Alike You are welcome to use this library for commercial purposes.),Applied computing
5784154,https://api.github.com/repos/jhades/jhades,jhades,JHades - Java classpath troubleshooting tool,Software and its engineering
5798893,https://api.github.com/repos/1ookup/LinEnum,LinEnum,Scripted Local Linux Enumeration & Privilege Escalation Checks,Security and privacy
5807266,https://api.github.com/repos/serilog/serilog,serilog,Simple .NET logging with fully-structured events,Security and privacy
5812279,https://api.github.com/repos/Jooordan/sandbox,sandbox,An empty sandbox project with only a gh-pages branch. Suitable for forking and playing.,Applied computing
5817753,https://api.github.com/repos/vysheng/tg,tg,telegram-cli,Software and its engineering
5828347,https://api.github.com/repos/HabitRPG/habitrpg,habitrpg,A habit tracker app which treats your goals like a Role Playing Game.,Human-centered computing
5829099,https://api.github.com/repos/parksilk/silkoramalympics,silkoramalympics,Website for the annual Silkoramalympics competition.,Networks
5846748,https://api.github.com/repos/tripit/slate,slate,Beautiful static documentation for your API,General and reference
5927767,https://api.github.com/repos/stroud109/JavaScriptExercise01,JavaScriptExercise01,Empty
5942149,https://api.github.com/repos/jacebrowning/template-python,template-python,Template for new Python projects.,General and reference
5944667,https://api.github.com/repos/nning/transmission-rss,transmission-rss,Adds torrents from rss feeds to transmission web frontend.,Networks
5979563,https://api.github.com/repos/johndavedecano/PHPLaravelGymManagementSystem,PHPLaravelGymManagementSystem,A simple and easy to install gym management system which includes package management,members managements,services and activities,Applied computing
5989485,https://api.github.com/repos/ausminternet/TaskPaperDaily,TaskPaperDaily,Extension for TaskPaper to handle absolute and relative dates.,Software and its engineering
6005713,https://api.github.com/repos/movibe/jQuery.msgBox,jQuery.msgBox,A smart message window plugin for jQuery.,Software and its engineering
6013073,https://api.github.com/repos/luochen1990/rainbow,rainbow,Rainbow Parentheses Improved,Human-centered computing
6023112,https://api.github.com/repos/iThomasTH/code,code,Empty
6065511,https://api.github.com/repos/xmpp-ftw/xmpp-ftw-demo,xmpp-ftw-demo,Demos/examples of using xmpp-ftw,General and reference
6068879,https://api.github.com/repos/DrKLO/Telegram,Telegram,Telegram for Android source,Applied computing
6085795,https://api.github.com/repos/jbeuckm/TiBeacons,TiBeacons,iBeacon advertising and scanning in a Titanium module,Software and its engineering
6087555,https://api.github.com/repos/andydrizen/ALDClock,ALDClock,An interactive clock component for iOS projects.,Human-centered computing
6095575,https://api.github.com/repos/onybo/Asp.Net-Identity-sample-app,Asp.Net-Identity-sample-app,Asp.Net Identity RC1 sample app,Networks
6096676,https://api.github.com/repos/zenorocha/dracula-theme,dracula-theme,:scream: A dark theme for Atom, Alfred, Emacs, iTerm, Slack, Sublime Text, Textmate, Terminal.app, Vim, Xcode, and Zsh,Human-centered computing
6108651,https://api.github.com/repos/mrtheke/algo2,algo2,Empty
6126544,https://api.github.com/repos/nakuldave/DjangoProjects,DjangoProjects,Empty
6169171,https://api.github.com/repos/johnnywjy/JYRadarChart,JYRadarChart,an iOS open source Radar Chart implementation,Human-centered computing
6172020,https://api.github.com/repos/limetext/lime,lime,Experimental Sublime Text clone,Software and its engineering
6191402,https://api.github.com/repos/LiranCohen/stickUp,stickUp,stickUp a jQuery Plugin for sticky navigation menus.,Human-centered computing
6196408,https://api.github.com/repos/tianon/dockerfiles,dockerfiles,A semi-random collection of odds and ends.,Software and its engineering
6210932,https://api.github.com/repos/xyl0n/iris-light,iris-light,A light version of the Iris Gtk theme. Aims to be clean, simple and bold.,Human-centered computing
6225214,https://api.github.com/repos/skydeck/haproxy,haproxy,The Reliable, High Performance TCP/HTTP Load Balancer,Networks
6236268,https://api.github.com/repos/kobotoolbox/kobocat,kobocat,A data aggregation and analysis platform,Information systems
6239513,https://api.github.com/repos/RedBrainLabs/system-graph,system-graph,Library for using Prismatic's Graph in large system composition... basically Graph + Lifecycle,Human-centered computing
6253776,https://api.github.com/repos/wit-ai/wit-ios-sdk,wit-ios-sdk,Wit.ai iOS SDK ,
6278048,https://api.github.com/repos/kevinzhow/PNChart,PNChart,A simple and beautiful chart lib used in Piner for iOS,
6278863,https://api.github.com/repos/SmeegeSec/HashTag,HashTag,Password Hash Identification,
6280726,https://api.github.com/repos/ckreibich/scholar.py,scholar.py,A parser for Google Scholar, written in Python,
6299920,https://api.github.com/repos/bostonlink/recon-ng-maltego,recon-ng-maltego,recon-ng Maltego local transform pack,
6307815,https://api.github.com/repos/Mimino666/django-admin-autoregister,django-admin-autoregister,Snippet to automatically create and register admin classes for models.,
6312005,https://api.github.com/repos/andreamazz/AMScrollingNavbar,AMScrollingNavbar,Scrollable UINavigationBar that follows the scrolling of a UIScrollView,
6318240,https://api.github.com/repos/feross/hostile,hostile,Simple `/etc/hosts` manipulation in node.js,
6328765,https://api.github.com/repos/fogleman/Craft,Craft,"Attempting to do OpenGL the \""modern\"" way.",
6399055,https://api.github.com/repos/ziyasal/FireSharp,FireSharp,.Net client library for Firebase REST API,
6403871,https://api.github.com/repos/Freeboard/freeboard,freeboard,A damn-sexy, open source real-time dashboard builder for IOT and other web mashups.,
6404061,https://api.github.com/repos/asm89/yac,yac,
6412773,https://api.github.com/repos/esl/MongooseIM,MongooseIM,Erlang-based implementation of Jabber / XMPP server with focus on performance and scalability,
6441856,https://api.github.com/repos/devttys0/binwalk,binwalk,Firmware Analysis Tool,
6442229,https://api.github.com/repos/activerecord-hackery/ransack,ransack,Object-based searching. With maintenance by @radar and @jonatack!,
6451691,https://api.github.com/repos/Ceasar/twosheds,twosheds,Command-line interface for Humans.,
6457494,https://api.github.com/repos/palfvin/avlats,avlats,
6462793,https://api.github.com/repos/jgilfelt/SystemBarTint,SystemBarTint,Apply background tinting to the Android system UI when using KitKat translucent modes,
6476825,https://api.github.com/repos/virtan/eep,eep,Erlang Easy Profiling (eep) application provides a way to analyze application performance and call hierarchy,
6496393,https://api.github.com/repos/Alexpux/MINGW-packages,MINGW-packages,Package scripts for MinGW-w64 targets to build under MSYS2.,
6498079,https://api.github.com/repos/ZeroEx/0x,0x,2013 Node Knockout entry - Zombies At My Conference,
6499244,https://api.github.com/repos/ilovenwd/eve,eve,REST API framework powered by Flask, MongoDB and good intentions,
6505671,https://api.github.com/repos/softius/yourls-static-titles,yourls-static-titles,Static titles for yourls service,
6533556,https://api.github.com/repos/mourlamstudios/ImageGrid-iOS,ImageGrid-iOS,asfd,
6571469,https://api.github.com/repos/mb0606/scratch,scratch,
6587692,https://api.github.com/repos/hugo53/HUChart,HUChart,A simple semi-circle chart,
6610198,https://api.github.com/repos/maickol/dagger,dagger,A fast dependency injector for Android and Java.,
6611850,https://api.github.com/repos/jivesoftware/PDTSimpleCalendar,PDTSimpleCalendar,A simple Calendar / Date Picker for iOS using UICollectionView,
6653643,https://api.github.com/repos/scala-js/scala-js,scala-js,Scala.js, the Scala to JavaScript compiler,
6699074,https://api.github.com/repos/guardian/scribe,scribe,
6704373,https://api.github.com/repos/cryptocat/cryptocat-ios,cryptocat-ios,Cryptocat for iOS. Easy to use encrypted instant messaging.,
6712024,https://api.github.com/repos/CanvasPod/Canvas,Canvas,Animate in Xcode without code,
6744736,https://api.github.com/repos/jaehack/AOTutorial,AOTutorial,A tutorial component with fade in / fade out animation for background images,
6753616,https://api.github.com/repos/smallcode/ChinaAPI,ChinaAPI,ŽÝ ¾ö¾Ð¡¾µ»Œ_¨Œ_‹ÛÉ_¨øŒ_¨Œ_‹Û¾á÷Œ¨‹ÛŠ¼¼Š¼¼ŒÕÎ± Ò£_äAPIŒ¼Ò,
6800846,https://api.github.com/repos/virtuald/vagrant-rekey-ssh,vagrant-rekey-ssh,Obsolete after Vagrant 1.7. Vagrant plugin which plugs default gaping holes in a vagrant box,
6816151,https://api.github.com/repos/libusb/libusb,libusb,A cross-platform user library providing access to USB devices ,
6843683,https://api.github.com/repos/greatfire/wiki,wiki,
6853230,https://api.github.com/repos/scotchmist/dyndns-cf,dyndns-cf,Simple DNS updater for CloudFlare's API,
6861499,https://api.github.com/repos/pythonbrasil/pythonbrasil10,pythonbrasil10,Site pythonbrasil 2014,
6882788,https://api.github.com/repos/atelierbram/vim-colors_atelier-schemes,vim-colors_atelier-schemes,For easy cloning Atelier Schemes for Vim colorschemes, with plugin manager Pathogen or Vundle,
6916565,https://api.github.com/repos/bjork24/Unison,Unison,Unifying named breakpoints across CSS, JS, and HTML,
6962535,https://api.github.com/repos/hkjels/story-model,story-model,Scrum story model,
6965555,https://api.github.com/repos/SublimeLinter/SublimeLinter-coffee,SublimeLinter-coffee,SublimeLinter plugin for CoffeeScript, using coffee --compile.,
6965574,https://api.github.com/repos/SublimeLinter/SublimeLinter-csslint,SublimeLinter-csslint,SublimeLinter plugin for CSS, using csslint.,
6970257,https://api.github.com/repos/uber/express-translate,express-translate,Add simple translation support to Express,
6988298,https://api.github.com/repos/carlsednaoui/ouibounce,ouibounce,Stop losing prospective customers.,
6988998,https://api.github.com/repos/etsy/AndroidStaggeredGrid,AndroidStaggeredGrid,An Android staggered grid view which supports multiple columns with rows of varying sizes.,
7001356,https://api.github.com/repos/roots/bedrock,bedrock,Modern WordPress stack that gets you started with the best development tools, practices, and project structure.,
7013556,https://api.github.com/repos/siuying/moria,moria,Auto Layout in RubyMotion.,
7019686,https://api.github.com/repos/likeastore/ngDialog,ngDialog,Modals and popups provider for Angular.js applications,
7075652,https://api.github.com/repos/socialsensor/graphdb-benchmarks,graphdb-benchmarks,Performance benchmark between popular graph databases.,
7089559,https://api.github.com/repos/jguido/php-redmine-api,php-redmine-api,A simple PHP Redmine API client, Object Oriented,
7105340,https://api.github.com/repos/Urigo/angular-spinkit,angular-spinkit,SpinKit (http://tobiasahlin.com/spinkit/) spinners for AngularJS,
7113913,https://api.github.com/repos/OpenHFT/OpenHFT,OpenHFT,Parent module to include active modules,
7132386,https://api.github.com/repos/dkhamsing/ios-asset-names,ios-asset-names,Guide to name iOS assets,
7146853,https://api.github.com/repos/jhoblitt/DateTime-Format-Human,DateTime-Format-Human,"Format times in \""spoken language\""",
"7147408""",https://api.github.com/repos/EverywhereHouseControl/Android-App,Android-App,AplicaciÌ_n para proyecto de domÌ_tica. VersiÌ_n Android,
7158417,https://api.github.com/repos/RubyMoney/monetize,monetize,A library for converting strings into `Money` objects.,
7164842,https://api.github.com/repos/cknadler/vim-anywhere,vim-anywhere,Use Vim everywhere you've always wanted to,
7170693,https://api.github.com/repos/miguelfreitas/twister-core,twister-core,twister core / daemon,
7182205,https://api.github.com/repos/Liangyongxu/spring-mvc-showcase,spring-mvc-showcase,Demonstrates the features of the Spring MVC web framework,
7189065,https://api.github.com/repos/Voxer/iSPDY,ispdy,SPDY client for OS X and iOS,
7190023,https://api.github.com/repos/staticapps/staticapps.org,staticapps.org,The source for the official StaticApps.org resource site.,
7198962,https://api.github.com/repos/Phoul/yara_rules,yara_rules,
7199692,https://api.github.com/repos/yunspace/chef-repo,chef-repo,A blank Chef repository - use as a base to build your own,
7212462,https://api.github.com/repos/go-lang-plugin-org/go-lang-idea-plugin,go-lang-idea-plugin,Google Go language IDE built using the Intellij Platform. Released both an integrated IDE and as a standalone Intellij IDEA plugin,
7215130,https://api.github.com/repos/beatfactor/nightwatch,nightwatch,UI automated testing framework based on node.js and selenium webdriver,
7222746,https://api.github.com/repos/Boris-Em/BEMSimpleLineGraph,BEMSimpleLineGraph,iOS library to create simple line graphs/charts (charting library).,
7228519,https://api.github.com/repos/badges/shields,shields,Shields.io specification, website and primary issue base,
7240106,https://api.github.com/repos/Trinea/android-open-project,android-open-project,Collect and classify android open source projects Œ_¨ŠÀÁŒÉÂŠ_ÑŒá•__codekk,
7249970,https://api.github.com/repos/amasad/debugjs.com,debugjs.com,Debug your JavaScript in the browser,
7258997,https://api.github.com/repos/eueln/ItemChests,ItemChests,ItemChests,
7259889,https://api.github.com/repos/ZackAlfakir/web,web,Chantilly Team 612's code website,
7260288,https://api.github.com/repos/travisjeffery/ClangFormat-Xcode,ClangFormat-Xcode,Xcode plug-in to to use clang-format from in Xcode and consistently format your code with Clang,
7266288,https://api.github.com/repos/ngbp/ngbp,ngbp,A sophisticated build management system for web apps (formerly ng-boilerplate). Created by @joshdmiller,
7276482,https://api.github.com/repos/cloudlocal/chosen,chosen,Chosen is a library for making long, unwieldy select boxes more friendly.,
7294438,https://api.github.com/repos/BrowserSync/gulp-browser-sync,gulp-browser-sync,How to use the BrowserSync module with gulp.,
7304063,https://api.github.com/repos/dlew/joda-time-android,joda-time-android,Joda-Time library with Android specialization,
7305150,https://api.github.com/repos/NateWr/simple-admin-pages,simple-admin-pages,A small wrapper for the WordPress settings API,
7306369,https://api.github.com/repos/thoughtbot/NSString-TBEncryption,NSString-TBEncryption,Tiny CocoaPod for NSString Encryption methods,
7306673,https://api.github.com/repos/HubSpot/shepherd,shepherd,Guide your users through a tour of your app #hubspot-open-source,
7308213,https://api.github.com/repos/insidegui/GRGlassWindow,GRGlassWindow,A NSWindow subclass with a beautiful glass-like title bar,
7326980,https://api.github.com/repos/nfroidure/gulp-iconfont,gulp-iconfont,Create icon fonts from several SVG icons,
7344511,https://api.github.com/repos/langerma/icinga-plugins,icinga-plugins,My ugly icinga plugins,
7361572,https://api.github.com/repos/sindresorhus/grunt-strip-debug,grunt-strip-debug,Strip console, alert, and debugger statements from JavaScript code,
7383416,https://api.github.com/repos/tj/node-delegates,node-delegates,Nodejs method and accessor delegation utility,
7412153,https://api.github.com/repos/macieks/Tiny2D,Tiny2D,An extremely easy to use, yet powerful, 2D game library.,
7420900,https://api.github.com/repos/neumino/rethinkdbdash,rethinkdbdash,Attempt for a faster node driver for RethinkDB,
7432562,https://api.github.com/repos/khaledhosny/ots,ots,
7461031,https://api.github.com/repos/openssh/openssh-portable,openssh-portable,Portable OpenSSH,
7489584,https://api.github.com/repos/Laverna/laverna,laverna,Open source alternative to evernote,
7504851,https://api.github.com/repos/jeffknupp/bull,bull,Bull always charges!,
7537997,https://api.github.com/repos/rdpeng/courses,courses,Course materials for the Data Science Specialization: https://www.coursera.org/specialization/jhudatascience/1,
7553911,https://api.github.com/repos/paroxp/Misago,Misago,Misago is fully featured forum application standing on shoulders of Django.,
7556976,https://api.github.com/repos/RomainPiel/Michelangelo,Michelangelo,Tiny android library to quickly inject a layout in your compound view,
7570729,https://api.github.com/repos/JakeWharton/u2020,u2020,A sample Android app which showcases advanced usage of Dagger among other open source libraries.,
7607012,https://api.github.com/repos/Raizlabs/RZTransitions,RZTransitions,A library of custom iOS View Controller Animations and Interactions.,
7617634,https://api.github.com/repos/afup/barometre,barometre,site public pour le baromÌ¬tre des salaires,
7623896,https://api.github.com/repos/magiteker/Bushido_Rush,Bushido_Rush,Android Game,
7645899,https://api.github.com/repos/docker-linux/kali,kali,Kali base box,
7654253,https://api.github.com/repos/Raizlabs/RZCellSizeManager,RZCellSizeManager,Dynamic size computation and caching for cells.,
7658667,https://api.github.com/repos/post72/php-node,php-node,Use PHP files in node, as Express view engine,
7666955,https://api.github.com/repos/morrisjs/morris.js,morris.js,Pretty time-series line graphs,
7722836,https://api.github.com/repos/splinesoft/SSBuild,SSBuild,A build script for continuous integration of iOS apps.,
7732133,https://api.github.com/repos/oxdi/vagrant-nixos,vagrant-nixos,Vagrant plugin to add nixos guest capabilities and nix provisioning,
7738640,https://api.github.com/repos/OpenTechFund/secure-email,secure-email,
7751311,https://api.github.com/repos/tmuxinator/tmuxinator,tmuxinator,Manage complex tmux sessions easily,
7753732,https://api.github.com/repos/systemjs/systemjs,systemjs,Universal dynamic module loader,
7769665,https://api.github.com/repos/ubolonton/js-csp,js-csp,CSP channels for Javascript (like Clojurescript's core.async, or Go),
7808122,https://api.github.com/repos/nadangergeo/RWD-Table-Patterns,RWD-Table-Patterns,Experimental table structure and behavior patterns based on progressive enhancement and responsive web design.,
7810452,https://api.github.com/repos/basecamp/pow,pow,Zero-configuration Rack server for Mac OS X,
7811703,https://api.github.com/repos/sindresorhus/gulp-plugin-boilerplate,gulp-plugin-boilerplate,Boilerplate to kickstart creating gulp plugins,
7835118,https://api.github.com/repos/sindresorhus/pageres,pageres,Capture website screenshots,
7846270,https://api.github.com/repos/hopegates/iesframework,iesframework,
7883108,https://api.github.com/repos/vasyabigi/angular-nouislider,angular-nouislider,Simple angular directive for jquery nouislider plugin,
7883561,https://api.github.com/repos/mruby/mruby.github.io,mruby.github.io,mruby - Embedded Ruby,
7890973,https://api.github.com/repos/NitikaAgarwal/cpython,cpython,Semi-official read-only mirror of the CPython Mercurial repository,
7924929,https://api.github.com/repos/SimonWaldherr/golang-examples,golang-examples,Go(lang) examples - (explain the basics of golang),
7940296,https://api.github.com/repos/iTyran/SK_CardGameServer,SK_CardGameServer,
7952993,https://api.github.com/repos/RichardWarburton/honest-profiler,honest-profiler,A sampling JVM profiler without the safepoint sample bias,
7980702,https://api.github.com/repos/andreis/interview,interview,Interview resources for SE candidates,
7990763,https://api.github.com/repos/treejames/Tracker,Tracker,Tracker,
8012811,https://api.github.com/repos/krasimir/techy,techy,A flat file CMS based on Gulp and AbsurdJS,
8017772,https://api.github.com/repos/boot2docker/boot2docker,boot2docker,Lightweight Linux for Docker,
8091268,https://api.github.com/repos/eljojo/learning-group,learning-group,Examples for my Ruby / Rails learning group,
8117762,https://api.github.com/repos/Kapeli/cheatset,cheatset,Generate cheat sheets for Dash,
8117944,https://api.github.com/repos/gerra/Java,Java,
8125526,https://api.github.com/repos/boot2docker/osx-installer,osx-installer,Docker installer for Mac OS X,
8137228,https://api.github.com/repos/deanishe/alfred-workflow,alfred-workflow,Helper library for writing Alfred 2 workflows in Python,
8142691,https://api.github.com/repos/tomkowz/TSAssetsPickerController,TSAssetsPickerController,Highly customizable control used to select multiple assets (saved photos and videos) for use in your app.,
8162617,https://api.github.com/repos/emmby/ormlite-android-extras,ormlite-android-extras,ORMLite Extras for Android,
8169424,https://api.github.com/repos/btmills/GeoPattern,GeoPattern,Built on jasonlong/geo_pattern,
8170478,https://api.github.com/repos/LambertoD/curriculum,curriculum,The open curriculum for learning web development,
8194675,https://api.github.com/repos/ChaplinWang/ReloadablePropertiesAnnotation,ReloadablePropertiesAnnotation,Dynamic property configurations reload during runtime utilising Java 7 WatchService API, Google Guava and Spring 3.1,
8228397,https://api.github.com/repos/mumusan/dotnetex,dotnetex,Gets size of .Net Framework objects, can change type of object to incompatible and can alloc .Net objects at unmanaged memory area,
8270641,https://api.github.com/repos/mobing/gperftools,gperftools,tcmalloc,
8296041,https://api.github.com/repos/MrS0m30n3/youtube-dl-gui,youtube-dl-gui,A cross platform front-end GUI of the popular youtube-dl written in Python.,
8313244,https://api.github.com/repos/philippine-devnet/laravel-starter,laravel-starter,Command to generate all the necessary files for laravel,
8339162,https://api.github.com/repos/mattt/Navajo,Navajo,
8339915,https://api.github.com/repos/phire/hackdriver,hackdriver,A hacky userspace v3d driver for the raspberry pi.,
8346508,https://api.github.com/repos/alexpell00/RcDawsonWebsite,RcDawsonWebsite,a single page sexy website for rc dawson.,
8387817,https://api.github.com/repos/iSECPartners/yontma-mac,yontma-mac,You'll Never Take Me Alive!,
8390641,https://api.github.com/repos/signaleleven/PMGS,PMGS,Poor man's ground system,
8404580,https://api.github.com/repos/ZIJ/svg-path,svg-path,Chainable SVG path string generator with some sugar added,
8405131,https://api.github.com/repos/segmentio/metalsmith,metalsmith,An extremely simple, pluggable static site generator.,
8416517,https://api.github.com/repos/chamikabm/incubator-spark,incubator-spark,Mirror of Apache Spark,
8427119,https://api.github.com/repos/mmin18/Dex65536,Dex65536,Solve the issue with dalvik compiler limitation on 65536 methods (Unable to execute dex: method ID not in [0, 0xffff]: 65536),
8450572,https://api.github.com/repos/40a/site,site,Devops deflope podcast site,
8475145,https://api.github.com/repos/hozwe/Ejecta,Ejecta,A Fast, Open Source JavaScript, Canvas & Audio Implementation for iOS,
8485455,https://api.github.com/repos/ncornette/Python-Markdown-Editor,Python-Markdown-Editor,Standalone editor for your markdown files,
8515356,https://api.github.com/repos/EmilS/2048-multiplayer,2048-multiplayer,Give it a try here:,
8532385,https://api.github.com/repos/kylestetz/lissajous,lissajous,A tool for programmatic audio performance in the browser using Javascript.,
8532554,https://api.github.com/repos/wymsee/cordova-HTTP,cordova-HTTP,Cordova / Phonegap plugin for communicating with HTTP servers.  Allows for SSL pinning!,
8566806,https://api.github.com/repos/chukong/EarthWarrior3D,EarthWarrior3D,
8576259,https://api.github.com/repos/uber/npm-shrinkwrap,npm-shrinkwrap,A consistent shrinkwrap tool,
8596480,https://api.github.com/repos/7ouma/CrunchyManga,CrunchyManga,Download Manga from crunchyroll,
8634501,https://api.github.com/repos/github/training-kit,training-kit,Open source slides, workbook, and cheat sheet courseware for teaching GitHub classes,
8670482,https://api.github.com/repos/inedu/frameTalk,frameTalk,
8688328,https://api.github.com/repos/mono/website,website,Mono's web site.,
8732866,https://api.github.com/repos/Lallo/gitignore,gitignore,A collection of useful .gitignore templates,
