`id`,`url`,`name`,`description`,`domain`
205834,https://api.github.com/repos/segoddnja/Comments-module,Comments-module,Comments module for Yii framework,Information systems
206270,https://api.github.com/repos/carbonfive/log_weasel,log_weasel,Instrument Rails and Resque with shared transaction IDs to trace execution of a unit of work across applications and application instances.,Software and its engineering
207212,https://api.github.com/repos/lexs/android-delicious,android-delicious,Human-centered computing
209924,https://api.github.com/repos/ryanb/importex,importex,Import an Excel file using Ruby.,Software and its engineering
214505,https://api.github.com/repos/lbdremy/gedit-jade,gedit-jade,Gedit Highlighting for Jade,Human-centered computing
214552,https://api.github.com/repos/hielkehoeve/wiquery-highcharts,wiquery-highcharts,Wiquery - highcharts binding component,Software and its engineering
216447,https://api.github.com/repos/schmittjoh/JMSDiExtraBundle,JMSDiExtraBundle,Provides Advanced Dependency Injection Features for Symfony2,Computing methodologies
219601,https://api.github.com/repos/jonobr1/two.js,Two.js,A renderer agnostic two-dimensional drawing api for the web.,Software and its engineering
220953,https://api.github.com/repos/pksunkara/pygments.js,pygments.js,A pygments wrapper for nodejs,Software and its engineering
222916,https://api.github.com/repos/pcreux/rspec-set,rspec-set,Helper set() for RSpec 2. Speed up your specs! :),Software and its engineering
223537,https://api.github.com/repos/lsegal/rubydoc.info,rubydoc.info,Next generation rdoc.info site,Applied computing
224435,https://api.github.com/repos/fazibear/colorize,colorize,Ruby string class extension. It add some methods to set color, background color and text effect on console easier using ANSI escape sequences.,Human-centered computing
231026,https://api.github.com/repos/tjarvstrand/edts,edts,Erlang Development Tool Suite,Software and its engineering
233193,https://api.github.com/repos/Granjow/slowmoVideo,slowmoVideo,slowmoVideo.granjow.net,Software and its engineering
238698,https://api.github.com/repos/areski/python-acapela,python-acapela,Text-To-Speech with Acapela,Human-centered computing
242564,https://api.github.com/repos/xarray/osgRecipes,osgRecipes,OpenSceneGraph (OSG) Recipes,Applied computing
243431,https://api.github.com/repos/AliSoftware/OHHTTPStubs,OHHTTPStubs,Stub your network requests easily! Test your apps with fake network data and custom response time, response code and headers!,Networks
244129,https://api.github.com/repos/kronosaur/Transcendence,Transcendence,The core Transcendence engine,Applied computing
244417,https://api.github.com/repos/echo3/echo3,echo3,"Echo is a platform for building web-based applications that approach the capabilities of rich clients. The applications are developed using a component-oriented and event-driven API, eliminating the need to deal with the \""page-based\"" nature of browsers. T",Software and its engineering
246730,https://api.github.com/repos/contiki/contiki-mirror,contiki-mirror,New official repository:,Hardware
255320,https://api.github.com/repos/mbrubeck/android-completion,android-completion,"Bash completion for \""adb\"" from the Google Android SDK",Human-centered computing
260066,https://api.github.com/repos/spectator/validates_email,validates_email,validates_email is a Rails 3 plugin that validates email addresses against RFC 2822 and RFC 3696,Software and its engineering
262948,https://api.github.com/repos/bindle/BindleKit,BindleKit,A collection of Objective-C classes that were created to fulfill a need in a particular project, but may be of use in other iOS or OS X projects.,Software and its engineering
263107,https://api.github.com/repos/oosmoxiecode/xgui.js,xgui.js,Some simple gui stuff to try and make js experimentation a bit easier.,Software and its engineering
267105,https://api.github.com/repos/moovweb/gvm,gvm,Go Version Manager,Applied computing
267717,https://api.github.com/repos/selectel/pyte,pyte,Simple VTXXX-compatible linux terminal emulator,Applied computing
276344,https://api.github.com/repos/jgehring/rsvndump,rsvndump,Remote Subversion repository dump,Software and its engineering
280617,https://api.github.com/repos/laserlemon/figaro,figaro,Simple Rails app configuration,Software and its engineering
284018,https://api.github.com/repos/wez/JLexPHP,JLexPHP,A lexer generator for PHP. It is based on JLex and requires Java to generate the lexer. Once generated, the lexer only requires PHP to run.,Software and its engineering
284075,https://api.github.com/repos/INCF/eeg-database,eeg-database, EEG/ERP portal enables community researchers to store, update, download and search data and metadata from EEG/ERP experiments. The system is developed as a standalone product,Information systems
285798,https://api.github.com/repos/infinispan/infinispan-quickstart,infinispan-quickstart,Infinispan examples,Applied computing
303616,https://api.github.com/repos/Poincare/sixthsense,sixthsense,Open Source Codebase for project SixthSense ,Applied computing
306833,https://api.github.com/repos/DrummerHead/HTML-Entities,HTML-Entities,List of commonly used HTML entities,General and reference
306908,https://api.github.com/repos/DavidKinder/Inform6,Inform6,The version of Inform 6 used as the code generator for Inform 7,Applied computing
307612,https://api.github.com/repos/jigpu/libwacom,libwacom,Personal development tree of libwacom,Applied computing
309661,https://api.github.com/repos/msonnabaum/drupalcon-training-chef-repo,drupalcon-training-chef-repo,Chef repo for the Drupalcon Performance and Scalability training,Software and its engineering
311780,https://api.github.com/repos/perf4j/perf4j,perf4j,Performance Monitoring and Statistics for Java Code,Software and its engineering
313268,https://api.github.com/repos/kanreisa/Chinachu,Chinachu,Chinachu is a open source EPG digital video recorder system for Linux.,Applied computing
319466,https://api.github.com/repos/pinax/django-forms-bootstrap,django-forms-bootstrap,Simple Twitter Bootstrap filter and templates for use with Django forms extracted from the Pinax Bootstrap theme.,Human-centered computing
321869,https://api.github.com/repos/wordpress-mobile/WordPress-iOS,WordPress-iOS,WordPress for iOS - Official repository,Information systems
323565,https://api.github.com/repos/pkrumins/node-png,node-png,A nodejs C++ module that given a buffer with RGB or RGBA values creates a PNG image (in memory).,Applied computing
326476,https://api.github.com/repos/tarjei/MemcacheBundle,MemcacheBundle,A Memcached service for Symfony,Information systems
328815,https://api.github.com/repos/mooz/percol,percol,adds flavor of interactive filtering to the traditional pipe concept of UNIX shell,Human-centered computing
335881,https://api.github.com/repos/photron/msys_setup,msys_setup,A set of scripts that setup an MSYS/MinGW environment on Windows and allow to compile libvirt and related libraries and tools.,Software and its engineering
337343,https://api.github.com/repos/pboling/capistrano_mailer,capistrano_mailer,Capistrano Deployment Email Notification,Software and its engineering
338816,https://api.github.com/repos/coreyfloyd/FJSTransitionController,FJSTransitionController,A drop in replacement for UINavigationController and/or UITabBarC ontroller on the iPhone that allows custom transition animations,Human-centered computing
343698,https://api.github.com/repos/Aegisub/Aegisub,Aegisub,Cross-platform advanced subtitle editor,Human-centered computing
344063,https://api.github.com/repos/jkff/timeplot,timeplot,Analyst's swiss army knife for visualizing data from ad-hoc log files,Applied computing
348868,https://api.github.com/repos/Olga-Yakovleva/RHVoice,RHVoice,RHVoice is a free and open source speech synthesizer for Russian language.,Human-centered computing
357887,https://api.github.com/repos/FasterXML/jackson-dataformat-yaml,jackson-dataformat-yaml,Jackson module to add YAML backend (parser/generator adapters),Software and its engineering
362053,https://api.github.com/repos/markbao/speakeasy,speakeasy,Easy two-factor authentication for node.js. Calculate time-based or counter-based one-time passwords. Supports the Google Authenticator mobile app. Uses the HMAC One-Time Password algorithms. Includes key generator.,Security and privacy
362894,https://api.github.com/repos/JasonSanford/leaflet-vector-layers,leaflet-vector-layers,A little help to viewing ArcGIS Server, Geocommons, Arc2Earth, CartoDB, GIS Cloud, etc. vector data in a Leaflet map,Human-centered computing
363605,https://api.github.com/repos/roysjosh/xbee-comm,xbee-comm,XBee communication libraries and utilities,Applied computing
366402,https://api.github.com/repos/derickbailey/jasmine.async,jasmine.async,Make Jasmine's asynchronous testing suck less.,Software and its engineering
374916,https://api.github.com/repos/mantisbt-plugins/timetracking,timetracking,Applied computing
383256,https://api.github.com/repos/fontello/typicons.font,typicons.font,transformed Typicons,Human-centered computing
386790,https://api.github.com/repos/CoatedMoose/CustomViews,CustomViews,A set of views for use in android applications, including a signature capture view.,Human-centered computing
410586,https://api.github.com/repos/yliang6/javelin,javelin,Large, bloated Javascript framework with an unintuitive, verbose syntax and very few features. Browsing its inelegant, poorly written source is an unwelcome experience.,Software and its engineering
414089,https://api.github.com/repos/jedisct1/pure-ftpd,pure-ftpd,Pure FTP server,Networks
419651,https://api.github.com/repos/briangonzalez/jquery.pep.js,jquery.pep.js,Pep, a lightweight plugin for kinetic drag on mobile/desktop,Human-centered computing
422791,https://api.github.com/repos/Nikku/jquery-tagit,jquery-tagit,JQuery plugin for auto completion of tags,Software and its engineering
427496,https://api.github.com/repos/FuseByExample/websocket-activemq-camel,websocket-activemq-camel,Example showing How to use HTML5 WebSocket with Apache ActiveMQ and Apache Camel,Networks
427934,https://api.github.com/repos/Senhordim/ibav,ibav,Site da Terceira igreja Batista do VarjÌ£o ,Human-centered computing
440795,https://api.github.com/repos/rejeep/yasnippets,yasnippets,Comprehensive collection of yasnippets,Applied computing
445199,https://api.github.com/repos/steipete/NSLogger-CocoaLumberjack-connector,NSLogger-CocoaLumberjack-connector,Software and its engineering
450059,https://api.github.com/repos/jlouis/rlimit,rlimit,Magnus Klaar's rate limiter code from etorrent,Software and its engineering
450328,https://api.github.com/repos/martinaglv/touchTouch,touchTouch,Touch Optimized Mobile Gallery,Human-centered computing
454235,https://api.github.com/repos/gamlerhart/akka-async-apis,akka-async-apis,Async Apis Which Work With Akka,Information systems
455467,https://api.github.com/repos/matenia/pin_it,pin_it,"A Ruby gem providing helper methods for inserting Pinterest.com \""Pin it\"" buttons into.",Human-centered computing
460773,https://api.github.com/repos/mericson/illustrator-scripts,illustrator-scripts,Illustrator Scripts,Applied computing
497181,https://api.github.com/repos/joehewitt/express-logger,express-logger,Express middleware for auto-archiving log files.,Applied computing
499056,https://api.github.com/repos/gbirke/Sanitize.js,Sanitize.js,Sanitize.js is a whitelist-based HTML sanitizer.,Security and privacy
519333,https://api.github.com/repos/fribeiro1/upic-ldap,upic-ldap,Custom Apache Camel Component,Applied computing
543497,https://api.github.com/repos/egonSchiele/contracts.ruby,contracts.ruby,Contracts for Ruby.,Software and its engineering
546329,https://api.github.com/repos/MaxGfeller/mongee,mongee,open source social network,Human-centered computing
569534,https://api.github.com/repos/clojure/math.combinatorics,math.combinatorics,Mathematics of computation
572040,https://api.github.com/repos/saltstack/salty-vagrant,salty-vagrant,Use Salt as a Vagrant provisioner.,Software and its engineering
576260,https://api.github.com/repos/ActiveState/stackato-cli,stackato-cli,Sources of the stackato command line client.,Applied computing
579759,https://api.github.com/repos/granth/command-number-tab,command-number-tab,Keyboard shortcuts for tabs in Safari and Terminal,Human-centered computing
601064,https://api.github.com/repos/toolness/quickpreso,quickpreso,Quickly prototype presentations the same way you prototype HTML pages.,Human-centered computing
603530,https://api.github.com/repos/ucnv/diff-for-gist.github,diff-for-gist.github,adds a diff function to http://gist.github.com/,Software and its engineering
615055,https://api.github.com/repos/Incubaid/baardskeerder,baardskeerder,A persistent B-ish-tree,Computing methodologies
640609,https://api.github.com/repos/matpow2/anaconda,anaconda,Anaconda is an open, cross-platform runtime for Multimedia Fusion 2, with support for Windows, Linux and Mac OS X.,Applied computing
643697,https://api.github.com/repos/hbons/Dazzle,Dazzle,A script to easily set up a SparkleShare host,Software and its engineering
651549,https://api.github.com/repos/SimonVT/android-menudrawer,android-menudrawer,*DEPRECATED* A slide-out menu implementation, which allows users to navigate between views in your app.,Human-centered computing
652682,https://api.github.com/repos/knutin/kprof,kprof,kprof allows you to profile the code path a request takes through your application. The trace is broken down into tiers, so you can see exactly how much time you spend in each layer of your app.,Software and its engineering
673716,https://api.github.com/repos/tontof/kriss_blog,kriss_blog,A simple and smart (or stupid) blogging tool.,Human-centered computing
677148,https://api.github.com/repos/fbx/librudp,librudp,UDP transport with optional reliability,Networks
683351,https://api.github.com/repos/marionettejs/backbone.marionette,backbone.marionette,Make your Backbone.js apps dance with a composite application architecture!,Software and its engineering
686542,https://api.github.com/repos/clojure/core.incubator,core.incubator,Proving ground for proposed new core fns,Software and its engineering
696102,https://api.github.com/repos/refinery/refinerycms,refinerycms,An extendable Ruby on Rails CMS that supports Rails 3.2,Information systems
705818,https://api.github.com/repos/elasticdog/puppet-sandbox,puppet-sandbox,A Vagrant-based Puppet development environment for creating new modules,Applied computing
718118,https://api.github.com/repos/dropbox/zxcvbn,zxcvbn,realistic password strength estimation,Security and privacy
719340,https://api.github.com/repos/13bold/Scribbler,Scribbler,A Cocoa framework for communicating with Last.fm and scrobbling new tracks.,Software and its engineering
723307,https://api.github.com/repos/wg-perception/PartsBasedDetector,PartsBasedDetector,"C++ implementation of Deva Ramanan's \""Articulated Pose Estimation with Flexible Mixtures of Parts\""",Applied computing
"724361""",https://api.github.com/repos/colinta/SublimeMoveText,SublimeMoveText,moves text, similar to TextMate's ‰Î÷‰ÎÄ‰ ,‰ Õ,‰ Ô,‰ Ò,Human-centered computing
726806,https://api.github.com/repos/bluesoft/pronto-agile,pronto-agile,agile projects managment,Applied computing
738430,https://api.github.com/repos/mgcrea/angular-strap,angular-strap,Bootstrap directives for Angular,Software and its engineering
742622,https://api.github.com/repos/ragunathjawahar/android-saripaar,android-saripaar,UI Validation Library for Android,Software and its engineering
743378,https://api.github.com/repos/omz/ColorSense-for-Xcode,ColorSense-for-Xcode,Plugin for Xcode to make working with colors more visual,Human-centered computing
748510,https://api.github.com/repos/larrybeall/JabbR.WPF,JabbR.WPF,Human-centered computing
750986,https://api.github.com/repos/joybro/node-dogstatsd,node-dogstatsd,node.js client for extended StatsD server of Datadog.,Applied computing
771049,https://api.github.com/repos/fragglet/c-algorithms,c-algorithms,C algorithms library,Computing methodologies
772395,https://api.github.com/repos/petehunt/loris,loris,High-performance JavaScript UIs,Software and its engineering
773433,https://api.github.com/repos/wojtekmach/minitest-rails-example,minitest-rails-example,Software and its engineering
784448,https://api.github.com/repos/cbucher/console,console,This is a modified version of Console 2 for a better experience under Windows Vista/7/8 and a better visual rendering. Built packages are available here:,Human-centered computing
788950,https://api.github.com/repos/treyhunner/resume,resume,LaTeX resume format,Human-centered computing
804708,https://api.github.com/repos/jaredfaris/gdi_JS1_LabTemplate,gdi_JS1_LabTemplate,Software and its engineering
811373,https://api.github.com/repos/movitto/omega,omega,The Omega Simulation Framework,Networks
811401,https://api.github.com/repos/sitesupport/gevent,gevent,gevent is hosted at https://github.com/gevent/gevent,Networks
812923,https://api.github.com/repos/videlalvaro/gifsockets,gifsockets,Real Time communication library using Animated Gifs as a transport‰ã¢,Networks
839143,https://api.github.com/repos/ton/vim-bufsurf,vim-bufsurf,Vim plugin that enables surfing through buffers based on viewing history per window.,Human-centered computing
843214,https://api.github.com/repos/bsmt/Assembler,Assembler,Assemble i386/x86_64 (intel and at&t syntax) and ARMv7 instructions to opcodes and more. ,General and reference
856494,https://api.github.com/repos/dalloliogm/taverna_workflows,taverna_workflows,my sample taverna workflows,General and reference
870927,https://api.github.com/repos/pmed/sqlitepp,sqlitepp,C++ wrapper to SQLite library,Information systems
911527,https://api.github.com/repos/kaustubh-karkare/aurora-online-judge,aurora-online-judge,A Programming Contest Control System with a Web Interface.,Applied computing
927777,https://api.github.com/repos/kvz/cronlock,cronlock,cronlock lets you deploy cronjobs cluster-wide without worrying about overlaps. It uses Redis to keep track of locks.,Applied computing
979207,https://api.github.com/repos/everpeace/ml-examples-by-scalala,ml-examples-by-scalala,Machine Learning Algorithms Samples By Scalala,Computing methodologies
1001578,https://api.github.com/repos/OpenTSDB/opentsdb,opentsdb,A scalable, distributed Time Series Database.,Information systems
1008365,https://api.github.com/repos/middleman/middleman-syntax,middleman-syntax,Code syntax highlighting plugin via pygments for middleman,Human-centered computing
1009716,https://api.github.com/repos/double-z/chef-cookbooks,chef-cookbooks,what it is,Software and its engineering
1011413,https://api.github.com/repos/kayru/insightprofiler,insightprofiler,Simple instrumented thread profiler for Win32 C++ applications.,Applied computing
1015480,https://api.github.com/repos/tarcieri/red25519,red25519,A Ruby binding to the Ed25519 public-key signature system,Security and privacy
1017307,https://api.github.com/repos/epeli/node-clim,node-clim,Console.Log IMproved for Node.js,Applied computing
1025135,https://api.github.com/repos/iplanwebsites/mdesjardins,mdesjardins,source (fall 2011),Applied computing
1027466,https://api.github.com/repos/tommoor/crumble,crumble,Crumble makes it easy to create feature tours in your website or app.,Human-centered computing
1031791,https://api.github.com/repos/vicapow/fav,fav,Parse favicon ICO files in node.js,Applied computing
1036996,https://api.github.com/repos/software-project/scrum-pm,scrum-pm,Scrum PM is a plugin for Redmine ticket management system. It adds Scrum items like backlog, dashboard and others.,Applied computing
1059797,https://api.github.com/repos/karacas/imgLiquid,imgLiquid,jQuery plugin to resize images to fit in a container.,Human-centered computing
1078185,https://api.github.com/repos/rickerbh/PXSourceList,PXSourceList,Source List control for the Mac,Human-centered computing
1080519,https://api.github.com/repos/jgalo80/dozer,dozer,Dozer is a Java Bean to Java Bean mapper that recursively copies data from one object to another. ,Software and its engineering
1083125,https://api.github.com/repos/stephenmcd/linkedout,linkedout,Build PDF resumes with the LinkedIn API,Human-centered computing
1084208,https://api.github.com/repos/alcacoop/go-github-client,go-github-client,a package to integrate Github REST API in go applications,Software and its engineering
1084793,https://api.github.com/repos/srinivasarao549/interactive-banners,interactive-banners,A few html5 experiments using js/canvas to create interactive banners,Networks
1093294,https://api.github.com/repos/techwizrd/MangaFox-Download-Script,MangaFox-Download-Script,A script that lets you download mangas from mangafox.com,Information systems
1098117,https://api.github.com/repos/tumf/media,media,Media files for use in your GitHub integration projects,Software and its engineering
1099822,https://api.github.com/repos/tailhook/libxs,libxs,Crossroads I/O core library - NOTE we do not accept pull requests,Software and its engineering
1100704,https://api.github.com/repos/rvirding/leex,leex,Lexical analyzer generator for Erlang,Software and its engineering
1117036,https://api.github.com/repos/kachayev/talks,talks,Talks and materials from different conferences, meetings etc,General and reference
1124381,https://api.github.com/repos/ajryan/WinHaste,WinHaste,Windows commandline client for hastebin.com,Software and its engineering
1186739,https://api.github.com/repos/dpantic/SpasticNav,SpasticNav,This is a simple lava lamp style navigation menu plugin, built with jQuery.,Software and its engineering
1189471,https://api.github.com/repos/jerryjianjun/xvisor,xvisor,eXtensible Versatile hyperviSOR,Human-centered computing
1195142,https://api.github.com/repos/mafintosh/root,root,a lightweight prototypical middleware web framework,Networks
1214622,https://api.github.com/repos/davidm/lua-fish,lua-fish,Parses Lua to abstract syntax tree (AST) using LPeg.,Software and its engineering
1228020,https://api.github.com/repos/stefan-zh/Facebook-Connect-Plugin-CakePHP,Facebook-Connect-Plugin-CakePHP,Facebook Connect Plugin for CakePHP now supports CakePHP 2.0,Networks
1242075,https://api.github.com/repos/shirok/Gauche-makiki,Gauche-makiki,A simple multithreaded http server,Networks
1248826,https://api.github.com/repos/paaland/omxplayer,omxplayer,omxplayer,Software and its engineering
1261926,https://api.github.com/repos/benlinton/bash-slugify,bash-slugify,Command that converts filenames and directories to a web friendly format.,Networks
1270737,https://api.github.com/repos/rstudio/shiny,shiny,Easy interactive web applications with R,Networks
1303073,https://api.github.com/repos/pheuter/iphone-3.0-cookbook-,iphone-3.0-cookbook-,Sample Code,Software and its engineering
1328973,https://api.github.com/repos/coreyhaines/ShoppingCart,ShoppingCart,Sample application to show fast rails tests,Software and its engineering
1344179,https://api.github.com/repos/tildeio/rsvp.js,rsvp.js,A lightweight library that provides tools for organizing asynchronous code,Software and its engineering
1352199,https://api.github.com/repos/rebar/rebar,rebar,Erlang build tool that makes it easy to compile and test Erlang applications, port drivers and releases.,Software and its engineering
1354419,https://api.github.com/repos/dpp/lawyersongithub,lawyersongithub,A Telegram site for the people who are lawyers and also have GitHub accounts,Applied computing
1366256,https://api.github.com/repos/kikinteractive/app,app,Instant mobile web app creation,Networks
1367068,https://api.github.com/repos/jenkinsci/debian-package-builder-plugin,debian-package-builder-plugin,Jenkins plugin for debian package building,Software and its engineering
1367228,https://api.github.com/repos/Frege/frege,frege,Frege is a non-strict, pure functional programming language in the spirit of Haskell. Frege programs are compiled to Java and run in a JVM.,Software and its engineering
1372746,https://api.github.com/repos/gtaylor/python-colormath,python-colormath,A python module that abstracts common color math operations. For example, converting from CIE L*a*b to XYZ, or from RGB to CMYK,Human-centered computing
1381021,https://api.github.com/repos/gitlabhq/gitlab-ci,gitlab-ci,Continuous integration server for gitlabhq,Software and its engineering
1382032,https://api.github.com/repos/meetselva/fixed-table-rows-cols,fixed-table-rows-cols,Fixed Table Header and Columns,Information systems
1391701,https://api.github.com/repos/kevinlacotaco/yuidoc-bootstrap-theme,yuidoc-bootstrap-theme,A revamped yuidoc theme with bootstrap,Applied computing
1397125,https://api.github.com/repos/toffaletti/libguri,libguri,A very fast URI parser in C.,Networks
1397723,https://api.github.com/repos/killbill/killbill,killbill,Open source billing platform,Software and its engineering
1404659,https://api.github.com/repos/unconed/MathBox.js,MathBox.js,MathBox is a (work in progress) library for making presentation-quality math diagrams in WebGL.,Human-centered computing
1412018,https://api.github.com/repos/Nexmo/Verify,Verify,Simple service to verify phone numbers or provide 2nd factor authentication.,Human-centered computing
1414836,https://api.github.com/repos/whuhacker/Sitedossier-Crawler,Sitedossier-Crawler,Crawler for sitedossier.com,Networks
1416473,https://api.github.com/repos/mbostock/topojson,topojson,An extension to GeoJSON that encodes topology.,Software and its engineering
1432150,https://api.github.com/repos/idiot/unslider,Unslider,The simplest jQuery slider there is.,Software and its engineering
1434458,https://api.github.com/repos/pardom/ActiveAndroid,ActiveAndroid,Active record style SQLite persistence for Android,Information systems
1436875,https://api.github.com/repos/scouttyg/rollbackoncheckout,rollbackoncheckout,A git post-checkout hook to roll back any migrations made between branches,Software and its engineering
